{
  "version": "1.0",
  "type": "EVENT",
  "event_id": "evt_0000000000c2",
  "session_id": "sess_0000000000a1",
  "timestamp": 1789788000500,
  "pid": 18342,
  "tid": 18350,
  "event_type": "HOOK_ENTER",
  "source": "runtime",
  "payload": {
    "hook_id": "hook_0000000000d1",
    "module": "libgame.so",
    "address": "0x7a3f1c0040",
    "arguments": [
      "0x1",
      "0x7ffd12ab"
    ],
    "backtrace": [
      "0x7a3f1c0040",
      "0x7a3f1c2210",
      "0x7a3f1d0088"
    ]
  }
}
